<?xml version="1.0" encoding="UTF-8" standalone="no"?>
<!DOCTYPE people SYSTEM "./peopleDTD.dtd">

<people>
	
	<husband employed="Yes">
		<name>John</name>
		<secondName>Gary</secondName>
		<age>40</age>
		<wife>
			<wname>Anna</wname>
			<age>30</age>
		</wife>
	</husband>

	<husband employed="No">
		<name>Jack</name>
		<age>25</age>
		<wife>
			<wname>Jane</wname>
			<secondName>Emma</secondName>
			<age>29</age>
		</wife>
	</husband>

</people>